[
  {
    "sessao_num": 1,
    "tipo_sessao": "ORDINÁRIA",
    "data_real": "01/02/2007",
    "pag_inicio": 10,
    "pag_fim": 22,
    "dcl_original": "DCL_2007-03-044.pdf",
    "nomenclatura": "2007-02-01-1-SO-001-2-AC.pdf",
    "data_publicacao_ata": "08/03/2007"
  },
  {
    "dcl_original": "DCL_2007-03-044.pdf",
    "pag_inicio": 22,
    "sessao_num": "002",
    "tipo_sessao": "ORDINÁRIA",
    "data_real": "6/02/2007",
    "nomenclatura": "2007-02-06-1-SO-002-2-AC.pdf",
    "pag_fim": 25,
    "data_publicacao_ata": "08/03/2007"
  },
  {
    "dcl_original": "DCL_2007-05-101.pdf",
    "pag_inicio": 1,
    "sessao_num": "002",
    "tipo_sessao": "EXTRAORDINÁRIA",
    "data_real": "2/05/2007",
    "nomenclatura": "2007-05-02-2-SE-002-2-AC.pdf",
    "pag_fim": 4,
    "data_publicacao_ata": "31/05/2007"
  },
  {
    "dcl_original": "DCL_2007-03-049.pdf",
    "pag_inicio": 1,
    "sessao_num": "003",
    "tipo_sessao": "ORDINÁRIA",
    "data_real": "7/02/2007",
    "nomenclatura": "2007-02-07-1-SO-003-2-AC.pdf",
    "pag_fim": 5,
    "data_publicacao_ata": "15/03/2007"
  },
  {
    "dcl_original": "DCL_2007-08-142.pdf",
    "pag_inicio": 1,
    "sessao_num": "003",
    "tipo_sessao": "EXTRAORDINÁRIA",
    "data_real": "2/05/2007",
    "nomenclatura": "2007-05-02-2-SE-003-2-AC.pdf",
    "pag_fim": 23,
    "data_publicacao_ata": "01/08/2007"
  },
  {
    "dcl_original": "DCL_2007-03-049.pdf",
    "pag_inicio": 5,
    "sessao_num": "004",
    "tipo_sessao": "ORDINÁRIA",
    "data_real": "8/02/2007",
    "nomenclatura": "2007-02-08-1-SO-004-2-AC.pdf",
    "pag_fim": 32,
    "data_publicacao_ata": "15/03/2007"
  },
  {
    "dcl_original": "DCL_2007-08-142.pdf",
    "pag_inicio": 23,
    "sessao_num": "005",
    "tipo_sessao": "EXTRAORDINÁRIA",
    "data_real": "9/05/2007",
    "nomenclatura": "2007-05-09-2-SE-005-2-AC.pdf",
    "pag_fim": 23,
    "data_publicacao_ata": "01/08/2007"
  },
  {
    "dcl_original": "DCL_2007-03-049.pdf",
    "pag_inicio": 32,
    "sessao_num": "006",
    "tipo_sessao": "ORDINÁRIA",
    "data_real": "14/02/2007",
    "nomenclatura": "2007-02-14-1-SO-006-2-AC.pdf",
    "pag_fim": 47,
    "data_publicacao_ata": "15/03/2007"
  },
  {
    "dcl_original": "DCL_2007-08-142.pdf",
    "pag_inicio": 23,
    "sessao_num": "006",
    "tipo_sessao": "EXTRAORDINÁRIA",
    "data_real": "10/05/2007",
    "nomenclatura": "2007-05-10-2-SE-006-2-AC.pdf",
    "pag_fim": 26,
    "data_publicacao_ata": "01/08/2007"
  },
  {
    "dcl_original": "DCL_2007-03-049.pdf",
    "pag_inicio": 48,
    "sessao_num": "007",
    "tipo_sessao": "ORDINÁRIA",
    "data_real": "15/02/2007",
    "nomenclatura": "2007-02-15-1-SO-007-2-AC.pdf",
    "pag_fim": 57,
    "data_publicacao_ata": "15/03/2007"
  },
  {
    "dcl_original": "DCL_2007-08-142.pdf",
    "pag_inicio": 26,
    "sessao_num": "007",
    "tipo_sessao": "EXTRAORDINÁRIA",
    "data_real": "16/05/2007",
    "nomenclatura": "2007-05-16-2-SE-007-2-AC.pdf",
    "pag_fim": 28,
    "data_publicacao_ata": "01/08/2007"
  },
  {
    "dcl_original": "DCL_2007-03-1766368715.pdf",
    "pag_inicio": 1,
    "sessao_num": "008",
    "tipo_sessao": "ORDINÁRIA",
    "data_real": "22/02/2007",
    "nomenclatura": "2007-02-22-1-SO-008-2-AC.pdf",
    "pag_fim": 15,
    "data_publicacao_ata": "26/03/2007"
  },
  {
    "dcl_original": "DCL_2007-08-142.pdf",
    "pag_inicio": 28,
    "sessao_num": "008",
    "tipo_sessao": "EXTRAORDINÁRIA",
    "data_real": "16/05/2007",
    "nomenclatura": "2007-05-16-2-SE-008-2-AC.pdf",
    "pag_fim": 29,
    "data_publicacao_ata": "01/08/2007"
  },
  {
    "dcl_original": "DCL_2007-08-142.pdf",
    "pag_inicio": 29,
    "sessao_num": "009",
    "tipo_sessao": "EXTRAORDINÁRIA",
    "data_real": "6/06/2007",
    "nomenclatura": "2007-06-06-2-SE-009-2-AC.pdf",
    "pag_fim": 33,
    "data_publicacao_ata": "01/08/2007"
  },
  {
    "dcl_original": "DCL_2007-03-1766368715.pdf",
    "pag_inicio": 15,
    "sessao_num": "010",
    "tipo_sessao": "ORDINÁRIA",
    "data_real": "28/02/2007",
    "nomenclatura": "2007-02-28-1-SO-010-2-AC.pdf",
    "pag_fim": 35,
    "data_publicacao_ata": "26/03/2007"
  },
  {
    "dcl_original": "DCL_2007-08-142.pdf",
    "pag_inicio": 33,
    "sessao_num": "010",
    "tipo_sessao": "EXTRAORDINÁRIA",
    "data_real": "13/06/2007",
    "nomenclatura": "2007-06-13-2-SE-010-2-AC.pdf",
    "pag_fim": 34,
    "data_publicacao_ata": "01/08/2007"
  },
  {
    "dcl_original": "DCL_2007-01-236.pdf",
    "pag_inicio": 23,
    "sessao_num": "011",
    "tipo_sessao": "ORDINÁRIA",
    "data_real": "28/11/2007",
    "nomenclatura": "2007-11-28-1-SO-011-2-AC.pdf",
    "pag_fim": 23,
    "data_publicacao_ata": "19/12/2007"
  },
  {
    "dcl_original": "DCL_2007-03-1766368715.pdf",
    "pag_inicio": 35,
    "sessao_num": "012",
    "tipo_sessao": "ORDINÁRIA",
    "data_real": "6/03/2007",
    "nomenclatura": "2007-03-06-1-SO-012-2-AC.pdf",
    "pag_fim": 48,
    "data_publicacao_ata": "26/03/2007"
  },
  {
    "dcl_original": "DCL_2007-03-060.pdf",
    "pag_inicio": 1,
    "sessao_num": "013",
    "tipo_sessao": "ORDINÁRIA",
    "data_real": "7/03/2007",
    "nomenclatura": "2007-03-07-1-SO-013-2-AC.pdf",
    "pag_fim": 6,
    "data_publicacao_ata": "30/03/2007"
  },
  {
    "dcl_original": "DCL_2007-09-1766369195.pdf",
    "pag_inicio": 1,
    "sessao_num": "013",
    "tipo_sessao": "EXTRAORDINÁRIA",
    "data_real": "29/06/2007",
    "nomenclatura": "2007-06-29-2-SE-013-2-AC.pdf",
    "pag_fim": 10,
    "data_publicacao_ata": "10/09/2007"
  },
  {
    "dcl_original": "DCL_2007-03-060.pdf",
    "pag_inicio": 6,
    "sessao_num": "014",
    "tipo_sessao": "ORDINÁRIA",
    "data_real": "8/03/2007",
    "nomenclatura": "2007-03-08-1-SO-014-2-AC.pdf",
    "pag_fim": 12,
    "data_publicacao_ata": "30/03/2007"
  },
  {
    "dcl_original": "DCL_2007-09-1766369195.pdf",
    "pag_inicio": 10,
    "sessao_num": "014",
    "tipo_sessao": "EXTRAORDINÁRIA",
    "data_real": "29/06/2007",
    "nomenclatura": "2007-06-29-2-SE-014-2-AC.pdf",
    "pag_fim": 13,
    "data_publicacao_ata": "10/09/2007"
  },
  {
    "dcl_original": "DCL_2007-03-060.pdf",
    "pag_inicio": 13,
    "sessao_num": "015",
    "tipo_sessao": "ORDINÁRIA",
    "data_real": "13/03/2007",
    "nomenclatura": "2007-03-13-1-SO-015-2-AC.pdf",
    "pag_fim": 24,
    "data_publicacao_ata": "30/03/2007"
  },
  {
    "dcl_original": "DCL_2007-05-1766368977.pdf",
    "pag_inicio": 1,
    "sessao_num": "016",
    "tipo_sessao": "ORDINÁRIA",
    "data_real": "14/03/2007",
    "nomenclatura": "2007-03-14-1-SO-016-2-AC.pdf",
    "pag_fim": 17,
    "data_publicacao_ata": "10/05/2007"
  },
  {
    "dcl_original": "DCL_2007-10-1766369225.pdf",
    "pag_inicio": 20,
    "sessao_num": "016",
    "tipo_sessao": "EXTRAORDINÁRIA",
    "data_real": "12/09/2007",
    "nomenclatura": "2007-09-12-2-SE-016-2-AC.pdf",
    "pag_fim": 22,
    "data_publicacao_ata": "19/10/2007"
  },
  {
    "dcl_original": "DCL_2007-05-1766368977.pdf",
    "pag_inicio": 17,
    "sessao_num": "017",
    "tipo_sessao": "ORDINÁRIA",
    "data_real": "15/03/2007",
    "nomenclatura": "2007-03-15-1-SO-017-2-AC.pdf",
    "pag_fim": 35,
    "data_publicacao_ata": "10/05/2007"
  },
  {
    "dcl_original": "DCL_2007-10-1766369225.pdf",
    "pag_inicio": 22,
    "sessao_num": "017",
    "tipo_sessao": "EXTRAORDINÁRIA",
    "data_real": "13/09/2007",
    "nomenclatura": "2007-09-13-2-SE-017-2-AC.pdf",
    "pag_fim": 24,
    "data_publicacao_ata": "19/10/2007"
  },
  {
    "dcl_original": "DCL_2007-05-1766368977.pdf",
    "pag_inicio": 36,
    "sessao_num": "018",
    "tipo_sessao": "ORDINÁRIA",
    "data_real": "20/03/2007",
    "nomenclatura": "2007-03-20-1-SO-018-2-AC.pdf",
    "pag_fim": 53,
    "data_publicacao_ata": "10/05/2007"
  },
  {
    "dcl_original": "DCL_2007-10-1766369225.pdf",
    "pag_inicio": 24,
    "sessao_num": "018",
    "tipo_sessao": "EXTRAORDINÁRIA",
    "data_real": "18/09/2007",
    "nomenclatura": "2007-09-18-2-SE-018-2-AC.pdf",
    "pag_fim": 24,
    "data_publicacao_ata": "19/10/2007"
  },
  {
    "dcl_original": "DCL_2007-05-088.pdf",
    "pag_inicio": 1,
    "sessao_num": "019",
    "tipo_sessao": "ORDINÁRIA",
    "data_real": "21/03/2007",
    "nomenclatura": "2007-03-21-1-SO-019-2-AC.pdf",
    "pag_fim": 45,
    "data_publicacao_ata": "14/05/2007"
  },
  {
    "dcl_original": "DCL_2007-10-1766369225.pdf",
    "pag_inicio": 24,
    "sessao_num": "019",
    "tipo_sessao": "EXTRAORDINÁRIA",
    "data_real": "19/09/2007",
    "nomenclatura": "2007-09-19-2-SE-019-2-AC.pdf",
    "pag_fim": 29,
    "data_publicacao_ata": "19/10/2007"
  },
  {
    "dcl_original": "DCL_2007-05-1766368966.pdf",
    "pag_inicio": 1,
    "sessao_num": "020",
    "tipo_sessao": "ORDINÁRIA",
    "data_real": "22/03/2007",
    "nomenclatura": "2007-03-22-1-SO-020-2-AC.pdf",
    "pag_fim": 9,
    "data_publicacao_ata": "15/05/2007"
  },
  {
    "dcl_original": "DCL_2007-05-1766368966.pdf",
    "pag_inicio": 9,
    "sessao_num": "021",
    "tipo_sessao": "ORDINÁRIA",
    "data_real": "27/03/2007",
    "nomenclatura": "2007-03-27-1-SO-021-2-AC.pdf",
    "pag_fim": 17,
    "data_publicacao_ata": "15/05/2007"
  },
  {
    "dcl_original": "DCL_2007-11-1766369269.pdf",
    "pag_inicio": 2,
    "sessao_num": "021",
    "tipo_sessao": "EXTRAORDINÁRIA",
    "data_real": "2/10/2007",
    "nomenclatura": "2007-10-02-2-SE-021-2-AC.pdf",
    "pag_fim": 2,
    "data_publicacao_ata": "27/09/2007"
  },
  {
    "dcl_original": "DCL_2007-05-1766368966.pdf",
    "pag_inicio": 17,
    "sessao_num": "022",
    "tipo_sessao": "ORDINÁRIA",
    "data_real": "28/03/2007",
    "nomenclatura": "2007-03-28-1-SO-022-2-AC.pdf",
    "pag_fim": 18,
    "data_publicacao_ata": "15/05/2007"
  },
  {
    "dcl_original": "DCL_2007-01-231.pdf",
    "pag_inicio": 33,
    "sessao_num": "023",
    "tipo_sessao": "EXTRAORDINÁRIA",
    "data_real": "17/10/2007",
    "nomenclatura": "2007-10-17-2-023-223-2-AC.pdf",
    "pag_fim": 35,
    "data_publicacao_ata": "12/12/2007"
  },
  {
    "dcl_original": "DCL_2007-05-1766368966.pdf",
    "pag_inicio": 18,
    "sessao_num": "023",
    "tipo_sessao": "ORDINÁRIA",
    "data_real": "29/03/2007",
    "nomenclatura": "2007-03-29-1-SO-023-2-AC.pdf",
    "pag_fim": 30,
    "data_publicacao_ata": "15/05/2007"
  },
  {
    "dcl_original": "DCL_2007-01-231.pdf",
    "pag_inicio": 35,
    "sessao_num": "024",
    "tipo_sessao": "EXTRAORDINÁRIA",
    "data_real": "23/10/2007",
    "nomenclatura": "2007-10-23-2-SE-024-2-AC.pdf",
    "pag_fim": 36,
    "data_publicacao_ata": "12/12/2007"
  },
  {
    "dcl_original": "DCL_2007-05-1766368966.pdf",
    "pag_inicio": 31,
    "sessao_num": "024",
    "tipo_sessao": "ORDINÁRIA",
    "data_real": "3/04/2007",
    "nomenclatura": "2007-04-03-1-SO-024-2-AC.pdf",
    "pag_fim": 38,
    "data_publicacao_ata": "15/05/2007"
  },
  {
    "dcl_original": "DCL_2007-05-093.pdf",
    "pag_inicio": 1,
    "sessao_num": "025",
    "tipo_sessao": "ORDINÁRIA",
    "data_real": "4/04/2007",
    "nomenclatura": "2007-04-04-1-SO-025-2-AC.pdf",
    "pag_fim": 6,
    "data_publicacao_ata": "21/05/2007"
  },
  {
    "dcl_original": "DCL_2007-12-1766369304.pdf",
    "pag_inicio": 6,
    "sessao_num": "025",
    "tipo_sessao": "EXTRAORDINÁRIA",
    "data_real": "25/10/2007",
    "nomenclatura": "2007-10-25-2-025-258-2-AC.pdf",
    "pag_fim": 7,
    "data_publicacao_ata": "17/12/2007"
  },
  {
    "dcl_original": "DCL_2007-05-093.pdf",
    "pag_inicio": 7,
    "sessao_num": "026",
    "tipo_sessao": "ORDINÁRIA",
    "data_real": "10/04/2007",
    "nomenclatura": "2007-04-10-1-SO-026-2-AC.pdf",
    "pag_fim": 15,
    "data_publicacao_ata": "21/05/2007"
  },
  {
    "dcl_original": "DCL_2007-01-235.pdf",
    "pag_inicio": 54,
    "sessao_num": "027",
    "tipo_sessao": "EXTRAORDINÁRIA",
    "data_real": "13/11/2007",
    "nomenclatura": "2007-11-13-2-027-278-2-AC.pdf",
    "pag_fim": 55,
    "data_publicacao_ata": "18/12/2007"
  },
  {
    "dcl_original": "DCL_2007-05-093.pdf",
    "pag_inicio": 15,
    "sessao_num": "027",
    "tipo_sessao": "ORDINÁRIA",
    "data_real": "11/04/2007",
    "nomenclatura": "2007-04-11-1-SO-027-2-AC.pdf",
    "pag_fim": 26,
    "data_publicacao_ata": "21/05/2007"
  },
  {
    "dcl_original": "DCL_2007-01-236.pdf",
    "pag_inicio": 34,
    "sessao_num": "028",
    "tipo_sessao": "EXTRAORDINÁRIA",
    "data_real": "27/10/2007",
    "nomenclatura": "2007-10-27-2-SE-028-2-AC.pdf",
    "pag_fim": 35,
    "data_publicacao_ata": "19/12/2007"
  },
  {
    "dcl_original": "DCL_2007-05-093.pdf",
    "pag_inicio": 26,
    "sessao_num": "028",
    "tipo_sessao": "ORDINÁRIA",
    "data_real": "12/04/2007",
    "nomenclatura": "2007-04-12-1-SO-028-2-AC.pdf",
    "pag_fim": 30,
    "data_publicacao_ata": "21/05/2007"
  },
  {
    "dcl_original": "DCL_2007-01-236.pdf",
    "pag_inicio": 35,
    "sessao_num": "029",
    "tipo_sessao": "EXTRAORDINÁRIA",
    "data_real": "28/11/2007",
    "nomenclatura": "2007-11-28-2-SE-029-2-AC.pdf",
    "pag_fim": 41,
    "data_publicacao_ata": "19/12/2007"
  },
  {
    "dcl_original": "DCL_2007-05-1766368939.pdf",
    "pag_inicio": 1,
    "sessao_num": "029",
    "tipo_sessao": "ORDINÁRIA",
    "data_real": "17/04/2007",
    "nomenclatura": "2007-04-17-1-SO-029-2-AC.pdf",
    "pag_fim": 24,
    "data_publicacao_ata": "22/05/2007"
  },
  {
    "dcl_original": "DCL_2007-01-236.pdf",
    "pag_inicio": 41,
    "sessao_num": "030",
    "tipo_sessao": "EXTRAORDINÁRIA",
    "data_real": "29/11/2007",
    "nomenclatura": "2007-11-29-2-SE-030-2-AC.pdf",
    "pag_fim": 41,
    "data_publicacao_ata": "19/12/2007"
  },
  {
    "dcl_original": "DCL_2007-05-1766368939.pdf",
    "pag_inicio": 24,
    "sessao_num": "031",
    "tipo_sessao": "ORDINÁRIA",
    "data_real": "19/04/2007",
    "nomenclatura": "2007-04-19-1-SO-031-2-AC.pdf",
    "pag_fim": 30,
    "data_publicacao_ata": "22/05/2007"
  },
  {
    "dcl_original": "DCL_2007-05-096.pdf",
    "pag_inicio": 1,
    "sessao_num": "032",
    "tipo_sessao": "ORDINÁRIA",
    "data_real": "24/04/2007",
    "nomenclatura": "2007-04-24-1-SO-032-2-AC.pdf",
    "pag_fim": 13,
    "data_publicacao_ata": "24/05/2007"
  },
  {
    "dcl_original": "DCL_2007-05-096.pdf",
    "pag_inicio": 14,
    "sessao_num": "033",
    "tipo_sessao": "ORDINÁRIA",
    "data_real": "25/04/2007",
    "nomenclatura": "2007-04-25-1-SO-033-2-AC.pdf",
    "pag_fim": 19,
    "data_publicacao_ata": "24/05/2007"
  },
  {
    "dcl_original": "DCL_2007-05-096.pdf",
    "pag_inicio": 19,
    "sessao_num": "034",
    "tipo_sessao": "ORDINÁRIA",
    "data_real": "26/04/2007",
    "nomenclatura": "2007-04-26-1-SO-034-2-AC.pdf",
    "pag_fim": 32,
    "data_publicacao_ata": "24/05/2007"
  },
  {
    "dcl_original": "DCL_2007-05-096.pdf",
    "pag_inicio": 32,
    "sessao_num": "035",
    "tipo_sessao": "ORDINÁRIA",
    "data_real": "2/05/2007",
    "nomenclatura": "2007-05-02-1-SO-035-2-AC.pdf",
    "pag_fim": 32,
    "data_publicacao_ata": "24/05/2007"
  },
  {
    "dcl_original": "DCL_2007-05-1766368920.pdf",
    "pag_inicio": 1,
    "sessao_num": "036",
    "tipo_sessao": "ORDINÁRIA",
    "data_real": "3/05/2007",
    "nomenclatura": "2007-05-03-1-SO-036-2-AC.pdf",
    "pag_fim": 12,
    "data_publicacao_ata": "25/05/2007"
  },
  {
    "dcl_original": "DCL_2007-05-101.pdf",
    "pag_inicio": 4,
    "sessao_num": "038",
    "tipo_sessao": "ORDINÁRIA",
    "data_real": "9/05/2007",
    "nomenclatura": "2007-05-09-1-SO-038-2-AC.pdf",
    "pag_fim": 11,
    "data_publicacao_ata": "31/05/2007"
  },
  {
    "dcl_original": "DCL_2007-06-114.pdf",
    "pag_inicio": 12,
    "sessao_num": "040",
    "tipo_sessao": "ORDINÁRIA",
    "data_real": "15/05/2007",
    "nomenclatura": "2007-05-15-1-SO-040-2-AC.pdf",
    "pag_fim": 20,
    "data_publicacao_ata": "20/06/2007"
  },
  {
    "dcl_original": "DCL_2007-06-114.pdf",
    "pag_inicio": 20,
    "sessao_num": "042",
    "tipo_sessao": "ORDINÁRIA",
    "data_real": "17/05/2007",
    "nomenclatura": "2007-05-17-1-SO-042-2-AC.pdf",
    "pag_fim": 20,
    "data_publicacao_ata": "20/06/2007"
  },
  {
    "dcl_original": "DCL_2007-06-114.pdf",
    "pag_inicio": 20,
    "sessao_num": "043",
    "tipo_sessao": "ORDINÁRIA",
    "data_real": "22/05/2007",
    "nomenclatura": "2007-05-22-1-SO-043-2-AC.pdf",
    "pag_fim": 23,
    "data_publicacao_ata": "20/06/2007"
  },
  {
    "dcl_original": "DCL_2007-06-114.pdf",
    "pag_inicio": 23,
    "sessao_num": "044",
    "tipo_sessao": "ORDINÁRIA",
    "data_real": "23/05/2007",
    "nomenclatura": "2007-05-23-1-SO-044-2-AC.pdf",
    "pag_fim": 37,
    "data_publicacao_ata": "20/06/2007"
  },
  {
    "dcl_original": "DCL_2007-06-114.pdf",
    "pag_inicio": 37,
    "sessao_num": "045",
    "tipo_sessao": "ORDINÁRIA",
    "data_real": "24/05/2007",
    "nomenclatura": "2007-05-24-1-SO-045-2-AC.pdf",
    "pag_fim": 37,
    "data_publicacao_ata": "20/06/2007"
  },
  {
    "dcl_original": "DCL_2007-07-128.pdf",
    "pag_inicio": 1,
    "sessao_num": "046",
    "tipo_sessao": "ORDINÁRIA",
    "data_real": "29/05/2007",
    "nomenclatura": "2007-05-29-1-SO-046-2-AC.pdf",
    "pag_fim": 3,
    "data_publicacao_ata": "10/07/2007"
  },
  {
    "dcl_original": "DCL_2007-07-128.pdf",
    "pag_inicio": 3,
    "sessao_num": "047",
    "tipo_sessao": "ORDINÁRIA",
    "data_real": "30/05/2007",
    "nomenclatura": "2007-05-30-1-SO-047-2-AC.pdf",
    "pag_fim": 23,
    "data_publicacao_ata": "10/07/2007"
  },
  {
    "dcl_original": "DCL_2007-10-1766369225.pdf",
    "pag_inicio": 1,
    "sessao_num": "048",
    "tipo_sessao": "ORDINÁRIA",
    "data_real": "26/09/2007",
    "nomenclatura": "2007-09-26-1-048-848-2-AC.pdf",
    "pag_fim": 0,
    "data_publicacao_ata": "19/10/2007"
  },
  {
    "dcl_original": "DCL_2007-07-128.pdf",
    "pag_inicio": 23,
    "sessao_num": "049",
    "tipo_sessao": "ORDINÁRIA",
    "data_real": "5/06/2007",
    "nomenclatura": "2007-06-05-1-SO-049-2-AC.pdf",
    "pag_fim": 32,
    "data_publicacao_ata": "10/07/2007"
  },
  {
    "dcl_original": "DCL_2007-07-128.pdf",
    "pag_inicio": 32,
    "sessao_num": "051",
    "tipo_sessao": "ORDINÁRIA",
    "data_real": "6/06/2007",
    "nomenclatura": "2007-06-06-1-SO-051-2-AC.pdf",
    "pag_fim": 32,
    "data_publicacao_ata": "10/07/2007"
  },
  {
    "dcl_original": "DCL_2007-07-130.pdf",
    "pag_inicio": 5,
    "sessao_num": "052",
    "tipo_sessao": "ORDINÁRIA",
    "data_real": "13/06/2007",
    "nomenclatura": "2007-06-13-1-SO-052-2-AC.pdf",
    "pag_fim": 13,
    "data_publicacao_ata": "13/07/2007"
  },
  {
    "dcl_original": "DCL_2007-07-130.pdf",
    "pag_inicio": 13,
    "sessao_num": "053",
    "tipo_sessao": "ORDINÁRIA",
    "data_real": "14/06/2007",
    "nomenclatura": "2007-06-14-1-SO-053-2-AC.pdf",
    "pag_fim": 19,
    "data_publicacao_ata": "13/07/2007"
  },
  {
    "dcl_original": "DCL_2007-07-130.pdf",
    "pag_inicio": 19,
    "sessao_num": "054",
    "tipo_sessao": "ORDINÁRIA",
    "data_real": "19/06/2007",
    "nomenclatura": "2007-06-19-1-SO-054-2-AC.pdf",
    "pag_fim": 23,
    "data_publicacao_ata": "13/07/2007"
  },
  {
    "dcl_original": "DCL_2007-07-130.pdf",
    "pag_inicio": 23,
    "sessao_num": "055",
    "tipo_sessao": "ORDINÁRIA",
    "data_real": "20/06/2007",
    "nomenclatura": "2007-06-20-1-SO-055-2-AC.pdf",
    "pag_fim": 28,
    "data_publicacao_ata": "13/07/2007"
  },
  {
    "dcl_original": "DCL_2007-07-130.pdf",
    "pag_inicio": 28,
    "sessao_num": "056",
    "tipo_sessao": "ORDINÁRIA",
    "data_real": "21/06/2007",
    "nomenclatura": "2007-06-21-1-SO-056-2-AC.pdf",
    "pag_fim": 35,
    "data_publicacao_ata": "13/07/2007"
  },
  {
    "dcl_original": "DCL_2007-08-144.pdf",
    "pag_inicio": 11,
    "sessao_num": "058",
    "tipo_sessao": "ORDINÁRIA",
    "data_real": "27/06/2007",
    "nomenclatura": "2007-06-27-1-SO-058-2-AC.pdf",
    "pag_fim": 12,
    "data_publicacao_ata": "03/08/2007"
  },
  {
    "dcl_original": "DCL_2007-08-144.pdf",
    "pag_inicio": 13,
    "sessao_num": "059",
    "tipo_sessao": "ORDINÁRIA",
    "data_real": "28/06/2007",
    "nomenclatura": "2007-06-28-1-SO-059-2-AC.pdf",
    "pag_fim": 14,
    "data_publicacao_ata": "03/08/2007"
  },
  {
    "dcl_original": "DCL_2007-08-162.pdf",
    "pag_inicio": 1,
    "sessao_num": "061",
    "tipo_sessao": "ORDINÁRIA",
    "data_real": "2/08/2007",
    "nomenclatura": "2007-08-02-1-SO-061-2-AC.pdf",
    "pag_fim": 9,
    "data_publicacao_ata": "29/08/2007"
  },
  {
    "dcl_original": "DCL_2007-08-162.pdf",
    "pag_inicio": 9,
    "sessao_num": "062",
    "tipo_sessao": "ORDINÁRIA",
    "data_real": "7/08/2007",
    "nomenclatura": "2007-08-07-1-SO-062-2-AC.pdf",
    "pag_fim": 12,
    "data_publicacao_ata": "29/08/2007"
  },
  {
    "dcl_original": "DCL_2007-08-162.pdf",
    "pag_inicio": 12,
    "sessao_num": "063",
    "tipo_sessao": "ORDINÁRIA",
    "data_real": "8/08/2007",
    "nomenclatura": "2007-08-08-1-SO-063-2-AC.pdf",
    "pag_fim": 23,
    "data_publicacao_ata": "29/08/2007"
  },
  {
    "dcl_original": "DCL_2007-08-162.pdf",
    "pag_inicio": 23,
    "sessao_num": "064",
    "tipo_sessao": "ORDINÁRIA",
    "data_real": "9/08/2007",
    "nomenclatura": "2007-08-09-1-SO-064-2-AC.pdf",
    "pag_fim": 24,
    "data_publicacao_ata": "29/08/2007"
  },
  {
    "dcl_original": "DCL_2007-08-162.pdf",
    "pag_inicio": 24,
    "sessao_num": "065",
    "tipo_sessao": "ORDINÁRIA",
    "data_real": "14/08/2007",
    "nomenclatura": "2007-08-14-1-SO-065-2-AC.pdf",
    "pag_fim": 31,
    "data_publicacao_ata": "29/08/2007"
  },
  {
    "dcl_original": "DCL_2007-08-162.pdf",
    "pag_inicio": 31,
    "sessao_num": "066",
    "tipo_sessao": "ORDINÁRIA",
    "data_real": "15/08/2007",
    "nomenclatura": "2007-08-15-1-SO-066-2-AC.pdf",
    "pag_fim": 38,
    "data_publicacao_ata": "29/08/2007"
  },
  {
    "dcl_original": "DCL_2007-08-162.pdf",
    "pag_inicio": 38,
    "sessao_num": "067",
    "tipo_sessao": "ORDINÁRIA",
    "data_real": "16/08/2007",
    "nomenclatura": "2007-08-16-1-SO-067-2-AC.pdf",
    "pag_fim": 47,
    "data_publicacao_ata": "29/08/2007"
  },
  {
    "dcl_original": "DCL_2007-08-162.pdf",
    "pag_inicio": 48,
    "sessao_num": "068",
    "tipo_sessao": "ORDINÁRIA",
    "data_real": "21/08/2007",
    "nomenclatura": "2007-08-21-1-SO-068-2-AC.pdf",
    "pag_fim": 51,
    "data_publicacao_ata": "29/08/2007"
  },
  {
    "dcl_original": "DCL_2007-09-167.pdf",
    "pag_inicio": 1,
    "sessao_num": "069",
    "tipo_sessao": "ORDINÁRIA",
    "data_real": "22/08/2007",
    "nomenclatura": "2007-08-22-1-SO-069-2-AC.pdf",
    "pag_fim": 10,
    "data_publicacao_ata": "05/09/2007"
  },
  {
    "dcl_original": "DCL_2007-09-167.pdf",
    "pag_inicio": 10,
    "sessao_num": "070",
    "tipo_sessao": "ORDINÁRIA",
    "data_real": "23/08/2007",
    "nomenclatura": "2007-08-23-1-SO-070-2-AC.pdf",
    "pag_fim": 22,
    "data_publicacao_ata": "05/09/2007"
  },
  {
    "dcl_original": "DCL_2007-11-1766369269.pdf",
    "pag_inicio": 3,
    "sessao_num": "087",
    "tipo_sessao": "ORDINÁRIA",
    "data_real": "3/10/2007",
    "nomenclatura": "2007-10-03-1-SO-087-2-AC.pdf",
    "pag_fim": 8,
    "data_publicacao_ata": "27/09/2007"
  },
  {
    "dcl_original": "DCL_2007-11-1766369269.pdf",
    "pag_inicio": 8,
    "sessao_num": "088",
    "tipo_sessao": "ORDINÁRIA",
    "data_real": "4/10/2007",
    "nomenclatura": "2007-10-04-1-088-888-2-AC.pdf",
    "pag_fim": 15,
    "data_publicacao_ata": "27/09/2007"
  },
  {
    "dcl_original": "DCL_2007-11-1766369269.pdf",
    "pag_inicio": 15,
    "sessao_num": "089",
    "tipo_sessao": "ORDINÁRIA",
    "data_real": "9/10/2007",
    "nomenclatura": "2007-10-09-1-SO-089-2-AC.pdf",
    "pag_fim": 21,
    "data_publicacao_ata": "27/09/2007"
  },
  {
    "dcl_original": "DCL_2007-11-1766369269.pdf",
    "pag_inicio": 21,
    "sessao_num": "090",
    "tipo_sessao": "ORDINÁRIA",
    "data_real": "10/10/2007",
    "nomenclatura": "2007-10-10-1-SO-090-2-AC.pdf",
    "pag_fim": 25,
    "data_publicacao_ata": "27/09/2007"
  },
  {
    "dcl_original": "DCL_2007-11-1766369269.pdf",
    "pag_inicio": 25,
    "sessao_num": "091",
    "tipo_sessao": "ORDINÁRIA",
    "data_real": "11/10/2007",
    "nomenclatura": "2007-10-11-1-SO-091-2-AC.pdf",
    "pag_fim": 26,
    "data_publicacao_ata": "27/09/2007"
  },
  {
    "dcl_original": "DCL_2007-01-231.pdf",
    "pag_inicio": 1,
    "sessao_num": "092",
    "tipo_sessao": "ORDINÁRIA",
    "data_real": "16/10/2007",
    "nomenclatura": "2007-10-16-1-SO-092-2-AC.pdf",
    "pag_fim": 9,
    "data_publicacao_ata": "12/12/2007"
  },
  {
    "dcl_original": "DCL_2007-01-231.pdf",
    "pag_inicio": 9,
    "sessao_num": "093",
    "tipo_sessao": "ORDINÁRIA",
    "data_real": "17/10/2007",
    "nomenclatura": "2007-10-17-1-SO-093-2-AC.pdf",
    "pag_fim": 20,
    "data_publicacao_ata": "12/12/2007"
  },
  {
    "dcl_original": "DCL_2007-01-231.pdf",
    "pag_inicio": 20,
    "sessao_num": "094",
    "tipo_sessao": "ORDINÁRIA",
    "data_real": "18/10/2007",
    "nomenclatura": "2007-10-18-1-SO-094-2-AC.pdf",
    "pag_fim": 29,
    "data_publicacao_ata": "12/12/2007"
  },
  {
    "dcl_original": "DCL_2007-01-231.pdf",
    "pag_inicio": 29,
    "sessao_num": "095",
    "tipo_sessao": "ORDINÁRIA",
    "data_real": "23/10/2007",
    "nomenclatura": "2007-10-23-1-SO-095-2-AC.pdf",
    "pag_fim": 33,
    "data_publicacao_ata": "12/12/2007"
  },
  {
    "dcl_original": "DCL_2007-01-232.pdf",
    "pag_inicio": 1,
    "sessao_num": "096",
    "tipo_sessao": "ORDINÁRIA",
    "data_real": "24/10/2007",
    "nomenclatura": "2007-10-24-1-SO-096-2-AC.pdf",
    "pag_fim": 14,
    "data_publicacao_ata": "13/12/2007"
  },
  {
    "dcl_original": "DCL_2007-12-1766369304.pdf",
    "pag_inicio": 7,
    "sessao_num": "098",
    "tipo_sessao": "ORDINÁRIA",
    "data_real": "30/10/2007",
    "nomenclatura": "2007-10-30-1-SO-098-2-AC.pdf",
    "pag_fim": 29,
    "data_publicacao_ata": "17/12/2007"
  },
  {
    "sessao_num": "100",
    "tipo_sessao": "ORDINÁRIA",
    "data_real": "01/11/2007",
    "pag_inicio": 1,
    "pag_fim": 1,
    "dcl_original": "DCL_2007-01-235.pdf",
    "nomenclatura": "2007-11-01-1-SO-100-2-AC.pdf",
    "data_publicacao_ata": "18/12/2007"
  },
  {
    "dcl_original": "DCL_2007-01-235.pdf",
    "pag_inicio": 2,
    "sessao_num": "101",
    "tipo_sessao": "ORDINÁRIA",
    "data_real": "6/11/2007",
    "nomenclatura": "2007-11-06-1-SO-101-2-AC.pdf",
    "pag_fim": 8,
    "data_publicacao_ata": "18/12/2007"
  },
  {
    "sessao_num": "102",
    "tipo_sessao": "ORDINÁRIA",
    "data_real": "07/11/2007",
    "pag_inicio": 8,
    "pag_fim": 23,
    "dcl_original": "DCL_2007-01-235.pdf",
    "nomenclatura": "2007-11-07-1-SO-102-2-AC.pdf",
    "data_publicacao_ata": "18/12/2007"
  },
  {
    "sessao_num": "103",
    "tipo_sessao": "ORDINÁRIA",
    "data_real": "08/11/2007",
    "pag_inicio": 23,
    "pag_fim": 23,
    "dcl_original": "DCL_2007-01-235.pdf",
    "nomenclatura": "2007-11-08-1-SO-103-2-AC.pdf",
    "data_publicacao_ata": "18/12/2007"
  },
  {
    "dcl_original": "DCL_2007-01-235.pdf",
    "pag_inicio": 37,
    "sessao_num": "104",
    "tipo_sessao": "ORDINÁRIA",
    "data_real": "13/11/2007",
    "nomenclatura": "2007-11-13-1-SO-104-2-AC.pdf",
    "pag_fim": 43,
    "data_publicacao_ata": "18/12/2007"
  },
  {
    "sessao_num": "105",
    "tipo_sessao": "ORDINÁRIA",
    "data_real": "14/11/2007",
    "pag_inicio": 43,
    "pag_fim": 43,
    "dcl_original": "DCL_2007-01-235.pdf",
    "nomenclatura": "2007-11-14-1-SO-105-2-AC.pdf",
    "data_publicacao_ata": "18/12/2007"
  },
  {
    "sessao_num": "106",
    "tipo_sessao": "ORDINÁRIA",
    "data_real": "20/11/2007",
    "pag_inicio": 43,
    "pag_fim": 54,
    "dcl_original": "DCL_2007-01-235.pdf",
    "nomenclatura": "2007-11-20-1-SO-106-2-AC.pdf",
    "data_publicacao_ata": "18/12/2007"
  },
  {
    "sessao_num": "107",
    "tipo_sessao": "ORDINÁRIA",
    "data_real": "21/10/2007",
    "pag_inicio": 1,
    "pag_fim": 6,
    "dcl_original": "DCL_2007-01-236.pdf",
    "nomenclatura": "2007-10-21-1-SO-107-2-AC.pdf",
    "data_publicacao_ata": "19/12/2007"
  },
  {
    "dcl_original": "DCL_2007-01-236.pdf",
    "pag_inicio": 7,
    "sessao_num": "108",
    "tipo_sessao": "ORDINÁRIA",
    "data_real": "22/10/2007",
    "nomenclatura": "2007-10-22-1-SO-108-2-AC.pdf",
    "pag_fim": 13,
    "data_publicacao_ata": "19/12/2007"
  },
  {
    "dcl_original": "DCL_2007-01-236.pdf",
    "pag_inicio": 13,
    "sessao_num": "109",
    "tipo_sessao": "ORDINÁRIA",
    "data_real": "27/11/2007",
    "nomenclatura": "2007-11-27-1-SO-109-2-AC.pdf",
    "pag_fim": 23,
    "data_publicacao_ata": "19/12/2007"
  },
  {
    "sessao_num": "110",
    "tipo_sessao": "ORDINÁRIA",
    "data_real": "28/11/2007",
    "pag_inicio": 23,
    "pag_fim": 30,
    "dcl_original": "DCL_2007-01-236.pdf",
    "nomenclatura": "2007-11-28-1-SO-110-2-AC.pdf",
    "data_publicacao_ata": "19/12/2007"
  },
  {
    "dcl_original": "DCL_2007-01-236.pdf",
    "pag_inicio": 31,
    "sessao_num": "111",
    "tipo_sessao": "ORDINÁRIA",
    "data_real": "29/11/2007",
    "nomenclatura": "2007-11-29-1-SO-111-2-AC.pdf",
    "pag_fim": 34,
    "data_publicacao_ata": "19/12/2007"
  },
  {
    "sessao_num": "84",
    "tipo_sessao": "ORDINÁRIA",
    "data_real": "26/09/2007",
    "pag_inicio": 1,
    "pag_fim": 9,
    "dcl_original": "DCL_2007-10-1766369225.pdf",
    "nomenclatura": "2007-09-26-1-SO-084-2-AC.pdf",
    "data_publicacao_ata": "19/10/2007"
  },
  {
    "sessao_num": "85",
    "tipo_sessao": "ORDINÁRIA",
    "data_real": "29/09/2007",
    "pag_inicio": 9,
    "pag_fim": 13,
    "dcl_original": "DCL_2007-10-1766369225.pdf",
    "nomenclatura": "2007-09-29-1-SO-085-2-AC.pdf",
    "data_publicacao_ata": "19/10/2007"
  },
  {
    "sessao_num": "86",
    "tipo_sessao": "ORDINÁRIA",
    "data_real": "02/10/2007",
    "pag_inicio": 13,
    "pag_fim": 20,
    "dcl_original": "DCL_2007-10-1766369225.pdf",
    "nomenclatura": "2007-10-02-1-SO-086-2-AC.pdf",
    "data_publicacao_ata": "19/10/2007"
  },
  {
    "sessao_num": 20,
    "tipo_sessao": "EXTRAORDINÁRIA",
    "data_real": "27/09/2007",
    "pag_inicio": 1,
    "pag_fim": 2,
    "dcl_original": "DCL_2007-11-1766369269.pdf",
    "nomenclatura": "2007-09-27-2-SE-020-2-AC.pdf",
    "data_publicacao_ata": "27/09/2007"
  },
  {
    "sessao_num": 21,
    "tipo_sessao": "EXTRAORDINÁRIA",
    "data_real": "02/10/2007",
    "pag_inicio": 2,
    "pag_fim": 3,
    "dcl_original": "DCL_2007-11-1766369269.pdf",
    "nomenclatura": "2007-10-02-2-SE-021-2-AC.pdf",
    "data_publicacao_ata": "27/09/2007"
  },
  {
    "dcl_original": "DCL_2007-04-076.pdf",
    "pag_inicio": 33,
    "pag_fim": 33,
    "sessao_num": "001",
    "tipo_sessao": "EXTRAORDINÁRIA",
    "data_real": "04/04/2007",
    "data_publicacao_ata": "25/04/2007",
    "nomenclatura": "2007-04-04-2-SE-001-2-AC.pdf"
  },
  {
    "dcl_original": "DCL_2007-03-049.pdf",
    "pag_inicio": 11,
    "pag_fim": 22,
    "sessao_num": "005",
    "tipo_sessao": "ORDINÁRIA",
    "data_real": "13/02/2007",
    "data_publicacao_ata": "15/03/2007",
    "nomenclatura": "2007-02-13-1-SO-005-2-AC.pdf"
  },
  {
    "dcl_original": "DCL_2007-03-047.pdf",
    "pag_inicio": 50,
    "pag_fim": 50,
    "sessao_num": "009",
    "tipo_sessao": "ORDINÁRIA",
    "data_real": "27/02/2007",
    "data_publicacao_ata": "14/03/2007",
    "nomenclatura": "2007-02-27-1-SO-009-2-AC.pdf"
  },
  {
    "dcl_original": "DCL_2007-05-094.pdf",
    "pag_inicio": 5,
    "pag_fim": 5,
    "sessao_num": "004",
    "tipo_sessao": "EXTRAORDINÁRIA",
    "data_real": "03/05/2007",
    "data_publicacao_ata": "23/05/2007",
    "nomenclatura": "2007-05-03-2-SE-004-2-AC.pdf"
  },
  {
    "dcl_original": "DCL_2007-05-094.pdf",
    "pag_inicio": 6,
    "pag_fim": 6,
    "sessao_num": "037",
    "tipo_sessao": "ORDINÁRIA",
    "data_real": "08/05/2007",
    "data_publicacao_ata": "23/05/2007",
    "nomenclatura": "2007-05-08-1-SO-037-2-AC.pdf"
  },
  {
    "dcl_original": "DCL_2007-05-099.pdf",
    "pag_inicio": 1,
    "pag_fim": 1,
    "sessao_num": "041",
    "tipo_sessao": "ORDINÁRIA",
    "data_real": "16/05/2007",
    "data_publicacao_ata": "28/05/2007",
    "nomenclatura": "2007-05-16-1-SO-041-2-AC.pdf"
  },
  {
    "dcl_original": "DCL_2007-06-1766369018.pdf",
    "pag_inicio": 1,
    "pag_fim": 1,
    "sessao_num": "050",
    "tipo_sessao": "ORDINÁRIA",
    "data_real": "06/06/2007",
    "data_publicacao_ata": "01/06/2007",
    "nomenclatura": "2007-06-06-1-SO-050-2-AC.pdf"
  },
  {
    "dcl_original": "DCL_2007-05-1766368939.pdf",
    "pag_inicio": 16,
    "pag_fim": 16,
    "sessao_num": "030",
    "tipo_sessao": "ORDINÁRIA",
    "data_real": "18/04/2007",
    "data_publicacao_ata": "01/05/2007",
    "nomenclatura": "2007-04-18-1-SO-030-2-AC.pdf"
  },
  {
    "dcl_original": "DCL_2007-06-109.pdf",
    "pag_inicio": 1,
    "pag_fim": 1,
    "sessao_num": "039",
    "tipo_sessao": "ORDINÁRIA",
    "data_real": "10/05/2007",
    "data_publicacao_ata": "01/06/2007",
    "nomenclatura": "2007-05-10-1-SO-039-2-AC.pdf"
  },
  {
    "dcl_original": "DCL_2007-08-144.pdf",
    "pag_inicio": 1,
    "pag_fim": 1,
    "sessao_num": "057",
    "tipo_sessao": "ORDINÁRIA",
    "data_real": "26/06/2007",
    "data_publicacao_ata": "03/08/2007",
    "nomenclatura": "2007-06-26-1-SO-057-2-AC.pdf"
  },
  {
    "dcl_original": "DCL_2007-07-124.pdf",
    "pag_inicio": 1,
    "pag_fim": 1,
    "sessao_num": "011",
    "tipo_sessao": "EXTRAORDINÁRIA",
    "data_real": "19/06/2007",
    "data_publicacao_ata": "01/07/2007",
    "nomenclatura": "2007-06-19-2-SE-011-2-AC.pdf"
  },
  {
    "dcl_original": "DCL_2007-07-124.pdf",
    "pag_inicio": 2,
    "pag_fim": 2,
    "sessao_num": "012",
    "tipo_sessao": "EXTRAORDINÁRIA",
    "data_real": "27/06/2007",
    "data_publicacao_ata": "01/07/2007",
    "nomenclatura": "2007-06-27-2-SE-012-2-AC.pdf"
  },
  {
    "dcl_original": "DCL_2007-09-166.pdf",
    "pag_inicio": 1,
    "pag_fim": 1,
    "sessao_num": "071",
    "tipo_sessao": "ORDINÁRIA",
    "data_real": "28/08/2007",
    "data_publicacao_ata": "01/09/2007",
    "nomenclatura": "2007-08-28-1-SO-071-2-AC.pdf"
  },
  {
    "dcl_original": "DCL_2007-09-170.pdf",
    "pag_inicio": 1,
    "pag_fim": 1,
    "sessao_num": "072",
    "tipo_sessao": "ORDINÁRIA",
    "data_real": "29/08/2007",
    "data_publicacao_ata": "01/09/2007",
    "nomenclatura": "2007-08-29-1-SO-072-2-AC.pdf"
  },
  {
    "dcl_original": "DCL_2007-09-170.pdf",
    "pag_inicio": 48,
    "pag_fim": 48,
    "sessao_num": "073",
    "tipo_sessao": "ORDINÁRIA",
    "data_real": "30/08/2007",
    "data_publicacao_ata": "01/09/2007",
    "nomenclatura": "2007-08-30-1-SO-073-2-AC.pdf"
  },
  {
    "dcl_original": "DCL_2007-09-171.pdf",
    "pag_inicio": 1,
    "pag_fim": 1,
    "sessao_num": "074",
    "tipo_sessao": "ORDINÁRIA",
    "data_real": "04/09/2007",
    "data_publicacao_ata": "01/09/2007",
    "nomenclatura": "2007-09-04-1-SO-074-2-AC.pdf"
  },
  {
    "dcl_original": "DCL_2007-09-172.pdf",
    "pag_inicio": 1,
    "pag_fim": 1,
    "sessao_num": "075",
    "tipo_sessao": "ORDINÁRIA",
    "data_real": "05/09/2007",
    "data_publicacao_ata": "01/09/2007",
    "nomenclatura": "2007-09-05-1-SO-075-2-AC.pdf"
  },
  {
    "dcl_original": "DCL_2007-09-172.pdf",
    "pag_inicio": 3,
    "pag_fim": 3,
    "sessao_num": "076",
    "tipo_sessao": "ORDINÁRIA",
    "data_real": "06/09/2007",
    "data_publicacao_ata": "01/09/2007",
    "nomenclatura": "2007-09-06-1-SO-076-2-AC.pdf"
  },
  {
    "dcl_original": "DCL_2007-09-1766369161.pdf",
    "pag_inicio": 1,
    "pag_fim": 1,
    "sessao_num": "077",
    "tipo_sessao": "ORDINÁRIA",
    "data_real": "11/09/2007",
    "data_publicacao_ata": "01/09/2007",
    "nomenclatura": "2007-09-11-1-SO-077-2-AC.pdf"
  },
  {
    "dcl_original": "DCL_2007-09-175.pdf",
    "pag_inicio": 1,
    "pag_fim": 1,
    "sessao_num": "015",
    "tipo_sessao": "EXTRAORDINÁRIA",
    "data_real": "11/09/2007",
    "data_publicacao_ata": "01/09/2007",
    "nomenclatura": "2007-09-11-2-SE-015-2-AC.pdf"
  },
  {
    "dcl_original": "DCL_2007-09-1766369157.pdf",
    "pag_inicio": 1,
    "pag_fim": 1,
    "sessao_num": "078",
    "tipo_sessao": "ORDINÁRIA",
    "data_real": "12/09/2007",
    "data_publicacao_ata": "01/09/2007",
    "nomenclatura": "2007-09-12-1-SO-078-2-AC.pdf"
  },
  {
    "dcl_original": "DCL_2007-09-1766369157.pdf",
    "pag_inicio": 28,
    "pag_fim": 28,
    "sessao_num": "079",
    "tipo_sessao": "ORDINÁRIA",
    "data_real": "13/09/2007",
    "data_publicacao_ata": "01/09/2007",
    "nomenclatura": "2007-09-13-1-SO-079-2-AC.pdf"
  },
  {
    "dcl_original": "DCL_2007-09-1766369146.pdf",
    "pag_inicio": 3,
    "pag_fim": 3,
    "sessao_num": "080",
    "tipo_sessao": "ORDINÁRIA",
    "data_real": "18/09/2007",
    "data_publicacao_ata": "01/09/2007",
    "nomenclatura": "2007-09-18-1-SO-080-2-AC.pdf"
  },
  {
    "dcl_original": "DCL_2007-09-1766369149.pdf",
    "pag_inicio": 60,
    "pag_fim": 60,
    "sessao_num": "081",
    "tipo_sessao": "ORDINÁRIA",
    "data_real": "19/09/2007",
    "data_publicacao_ata": "01/09/2007",
    "nomenclatura": "2007-09-19-1-SO-081-2-AC.pdf"
  },
  {
    "dcl_original": "DCL_2007-09-1766369146.pdf",
    "pag_inicio": 2,
    "pag_fim": 2,
    "sessao_num": "082",
    "tipo_sessao": "ORDINÁRIA",
    "data_real": "20/09/2007",
    "data_publicacao_ata": "01/09/2007",
    "nomenclatura": "2007-09-20-1-SO-082-2-AC.pdf"
  },
  {
    "dcl_original": "DCL_2007-12-1766369304.pdf",
    "pag_inicio": 13,
    "pag_fim": 13,
    "sessao_num": "099",
    "tipo_sessao": "ORDINÁRIA",
    "data_real": "31/10/2007",
    "data_publicacao_ata": "01/12/2007",
    "nomenclatura": "2007-10-31-1-SO-099-2-AC.pdf"
  },
  {
    "dcl_original": "DCL_2008-02-1766369371.pdf",
    "pag_inicio": 17,
    "pag_fim": 17,
    "sessao_num": "113",
    "tipo_sessao": "ORDINÁRIA",
    "data_real": "05/12/2007",
    "data_publicacao_ata": "01/02/2008",
    "nomenclatura": "2007-12-05-1-SO-113-2-AC.pdf"
  },
  {
    "dcl_original": "DCL_2008-02-1766369371.pdf",
    "pag_inicio": 33,
    "pag_fim": 33,
    "sessao_num": "114",
    "tipo_sessao": "ORDINÁRIA",
    "data_real": "06/12/2007",
    "data_publicacao_ata": "01/02/2008",
    "nomenclatura": "2007-12-06-1-SO-114-2-AC.pdf"
  },
  {
    "dcl_original": "DCL_2008-02-1766369379.pdf",
    "pag_inicio": 1,
    "pag_fim": 1,
    "sessao_num": "031",
    "tipo_sessao": "EXTRAORDINÁRIA",
    "data_real": "04/12/2007",
    "data_publicacao_ata": "01/02/2008",
    "nomenclatura": "2007-12-04-2-SE-031-2-AC.pdf"
  },
  {
    "dcl_original": "DCL_2008-02-1766369379.pdf",
    "pag_inicio": 2,
    "pag_fim": 2,
    "sessao_num": "032",
    "tipo_sessao": "EXTRAORDINÁRIA",
    "data_real": "05/12/2007",
    "data_publicacao_ata": "01/02/2008",
    "nomenclatura": "2007-12-05-2-SE-032-2-AC.pdf"
  },
  {
    "dcl_original": "DCL_2008-02-1766369363.pdf",
    "pag_inicio": 35,
    "pag_fim": 35,
    "sessao_num": "033",
    "tipo_sessao": "EXTRAORDINÁRIA",
    "data_real": "11/12/2007",
    "data_publicacao_ata": "01/02/2008",
    "nomenclatura": "2007-12-11-2-SE-033-2-AC.pdf"
  },
  {
    "dcl_original": "DCL_2008-02-1766369363.pdf",
    "pag_inicio": 38,
    "pag_fim": 38,
    "sessao_num": "034",
    "tipo_sessao": "EXTRAORDINÁRIA",
    "data_real": "12/12/2007",
    "data_publicacao_ata": "01/02/2008",
    "nomenclatura": "2007-12-12-2-SE-034-2-AC.pdf"
  }
]